{
  "template": {
    "id": "lambro-web-app-template",
    "version": "1.0.0",
    "demo": "todo"
  },
  "organization": {
    "name": "LumbreCode",
    "domain": "lumbrecode.de",
    "url": "https://lumbrecode.de",
    "webAppsDomain": "webapps.lumbrecode.de",
    "contactLocalParts": {
      "contact": "Y29udGFjdA==",
      "support": "c3VwcG9ydA==",
      "feedback": "ZmVlZGJhY2s=",
      "bugs": "YnVncw==",
      "privacy": "cHJpdmFjeQ==",
      "security": "c2VjdXJpdHk="
    }
  },
  "application": {
    "name": "Foldmark",
    "shortName": "Foldmark",
    "slug": "foldmark",
    "description": "Local-first editor for letters, print profiles, fold marks, postcards and privacy-friendly document export.",
    "packageName": "foldmark",
    "version": "1.0.0",
    "defaultLocale": "de",
    "supportedLocales": ["de", "en"],
    "repositoryOwner": "FlorianTim",
    "repositoryName": "Foldmark",
    "githubPagesBase": "auto",
    "customDomain": "auto",
    "theme": "paper",
    "license": "MIT"
  },
  "features": {
    "demoTodo": false,
    "indexedDb": true,
    "i18n": true,
    "themes": true,
    "privacyCenter": true,
    "pwa": false,
    "externalConnectors": false,
    "printProfiles": true,
    "letterWorkspace": true,
    "postcardDuplex": true,
    "emailHandoff": true,
    "localAssets": true
  }
}
